{
  "$schema": "https://json-schema.org/draft/2020-12/schema",
  "$id": "https://github.com/jeremylongworth-source/AgentCADCAM/schemas/state.schema.json",
  "title": "Bounded CAD/CAM Job State",
  "type": "object",
  "additionalProperties": false,
  "required": ["job_id", "revision", "source_artifact_hashes", "process_family", "approval_status"],
  "properties": {
    "job_id": {"type": "string", "minLength": 1},
    "revision": {"type": "string", "minLength": 1},
    "source_artifact_hashes": {"type": "array", "items": {"type": "string"}},
    "units": {"type": ["string", "null"]},
    "process_family": {"enum": ["cad_handoff", "cnc_milling", "additive", "laser_cutting", "unknown"]},
    "material": {"type": ["object", "null"]},
    "machine_profile": {"type": ["object", "null"]},
    "controller_profile": {"type": ["object", "null"]},
    "setup": {"type": ["object", "null"]},
    "workholding": {"type": ["object", "null"]},
    "work_coordinate_system": {"type": ["object", "null"]},
    "tool_library": {"type": ["object", "null"]},
    "cam_system": {"type": ["string", "null"]},
    "postprocessor": {"type": ["object", "null"]},
    "post_version": {"type": ["string", "null"]},
    "generated_manufacturing_output": {"type": ["object", "null"]},
    "simulation_status": {"type": ["string", "null"]},
    "verification_results": {"type": "array", "items": {"type": "object"}},
    "jurisdiction": {"type": ["string", "null"]},
    "ip_status": {"type": ["object", "null"]},
    "export_review_status": {"type": ["string", "null"]},
    "approval_status": {"enum": ["not_requested", "pending", "approved", "invalidated", "rejected"]}
  }
}
