{
  "job_id": "additive-fdm-bracket",
  "revision": "B",
  "units": "mm",
  "source_artifact_hashes": [
    "100c7de74d5e3b1dfea37f2c3b7f7d8182339d053acee6f711a167f5d2cdb811"
  ],
  "process_family": "additive",
  "material": {
    "lifecycle": {
      "revision": "1",
      "applicability": "Offline additive/fdm-bracket synthetic material fixture only; no physical manufacturing applicability established.",
      "units": {},
      "verification": {
        "status": "unverified",
        "reviewed_revision": null,
        "reviewer": null,
        "reviewed_at": null,
        "evidence": [],
        "notes": "Synthetic fixture declaration; no practitioner review has been performed."
      }
    },
    "material_id": "fixture-pla",
    "process_family": "additive",
    "grade_or_profile": "synthetic PLA profile",
    "properties": {},
    "compatibility": {
      "printers": [
        "fixture-printer-fdm"
      ],
      "slicer_profiles": [
        "fixture-pla-profile"
      ]
    },
    "environmental_requirements": {
      "environment_status": "known"
    },
    "source": {
      "title": "Synthetic FDM material profile",
      "publisher": "CAD/CAM Skills",
      "locator": "fixtures/additive/fdm-bracket/contexts/material.json",
      "published_at": null,
      "accessed_at": "2026-09-13",
      "scope": "Offline FDM compatibility tests only; not filament properties, slicer settings, or environmental safety evidence.",
      "claims": [
        "The material fixture links fixture-pla to a synthetic printer and slicer profile and declares a known environment status."
      ]
    }
  },
  "machine_profile": {
    "lifecycle": {
      "revision": "1",
      "applicability": "Offline additive/fdm-bracket synthetic printer fixture only; no physical manufacturing applicability established.",
      "units": {
        "length": "mm"
      },
      "verification": {
        "status": "unverified",
        "reviewed_revision": null,
        "reviewer": null,
        "reviewed_at": null,
        "evidence": [],
        "notes": "Synthetic fixture declaration; no practitioner review has been performed."
      }
    },
    "machine_id": "fixture-printer-fdm",
    "process_family": "additive",
    "manufacturer": "Synthetic Fixture",
    "model": "FDM printer",
    "capabilities": {
      "build_volume": {
        "x": 200,
        "y": 200,
        "z": 200
      },
      "materials": [
        "fixture-pla"
      ]
    },
    "limits": {},
    "source": {
      "title": "Synthetic FDM printer profile",
      "publisher": "CAD/CAM Skills",
      "locator": "fixtures/additive/fdm-bracket/contexts/printer.json",
      "published_at": null,
      "accessed_at": "2026-09-13",
      "scope": "Offline FDM fixture checks only; not an OEM build-volume or material specification.",
      "claims": [
        "The printer fixture declares a synthetic build-volume tuple and fixture-pla compatibility."
      ]
    }
  },
  "controller_profile": null,
  "setup": {
    "context_kind": "additive_evaluation_input",
    "evaluation_only": true,
    "submitted_job": {
      "job_id": "additive-fdm-bracket",
      "revision": "B",
      "mesh_format": "STL",
      "mesh_sha256": "9447459b1eeb56d1cf1810dbbdd2f1598d349646a96b7183c682c600992e460e",
      "mesh_status": "valid",
      "mesh_units": "mm",
      "model_dimensions": {
        "x": 60,
        "y": 40,
        "z": 30
      },
      "printer_id": "fixture-printer-fdm",
      "material_id": "fixture-pla",
      "slicer_profile_status": "verified",
      "orientation_status": "reviewed",
      "support_status": "reviewed",
      "environment_status": "known",
      "approval_status": "not_requested"
    },
    "source_revision": "A"
  },
  "workholding": null,
  "work_coordinate_system": null,
  "tool_library": null,
  "cam_system": null,
  "postprocessor": null,
  "post_version": null,
  "generated_manufacturing_output": {
    "artifact_id": "additive-revision-mismatch",
    "path": "replay:additive/revision-mismatch/input.stl",
    "kind": "mesh_derivative",
    "authority": "derived",
    "revision": "A",
    "units": "mm",
    "sha256": "9447459b1eeb56d1cf1810dbbdd2f1598d349646a96b7183c682c600992e460e"
  },
  "simulation_status": "not_run",
  "jurisdiction": null,
  "ip_status": {
    "ownership_status": "repository_authored_synthetic",
    "licence_status": "CC0-1.0 fixture",
    "confidentiality": "public_test_data",
    "redistribution_authorized": true
  },
  "export_review_status": "not_reviewed",
  "approval_status": "not_requested",
  "verification_results": [
    {
      "check_id": "additive_partial_geometry_and_context",
      "status": "inconclusive",
      "summary": "File-derived partial evidence only; profile, intent, slicer, orientation/support, environment and qualified review are unresolved.",
      "evidence": [
        "docs/evaluation/additive-runs/2026-09-17-revision-mismatch/observed.json"
      ]
    }
  ]
}
