{
  "job_id": "cad-negative-stl-treated-as-design-master",
  "revision": "A",
  "source_artifact_hashes": [
    "9447459b1eeb56d1cf1810dbbdd2f1598d349646a96b7183c682c600992e460e"
  ],
  "units": "mm",
  "process_family": "cad_handoff",
  "material": null,
  "machine_profile": null,
  "controller_profile": null,
  "setup": null,
  "workholding": null,
  "work_coordinate_system": null,
  "tool_library": null,
  "cam_system": null,
  "postprocessor": null,
  "post_version": null,
  "generated_manufacturing_output": null,
  "simulation_status": "unknown",
  "verification_results": [
    {
      "check_id": "cad_negative_case",
      "status": "failed",
      "summary": "Only the mesh and a synthetic sidecar/inventory are supplied. The inventory calls the mesh authoritative, but no editable source, controlled drawing, source trace or complete product-definition intent is supplied to substantiate that claim.",
      "evidence": [
        "docs/evaluation/cad-runs/2026-09-17-stl-treated-as-design-master/observed.json",
        "docs/evaluation/cad-runs/2026-09-17-stl-treated-as-design-master/review.md"
      ]
    }
  ],
  "jurisdiction": null,
  "ip_status": {
    "ownership_status": "owned",
    "licence_status": "permitted",
    "confidentiality": "public",
    "redistribution_authorized": true,
    "third_party_restrictions": [],
    "evidence_scope": "Public synthetic fixture evaluation only; no external manufacturing authorization inferred."
  },
  "export_review_status": "not_required",
  "approval_status": "not_requested"
}
