{
  "job_id": "cad-negative-conflicting-dimensions",
  "revision": "A",
  "source_artifact_hashes": [
    "100c7de74d5e3b1dfea37f2c3b7f7d8182339d053acee6f711a167f5d2cdb811",
    "9447459b1eeb56d1cf1810dbbdd2f1598d349646a96b7183c682c600992e460e",
    "fdd8e0913447b127b4734b9f090235051c3fc63ec841be05b9ac496f63dd6acd",
    "df0f54ab6e130958e5fe547f0e07752fd0784a13a149b317a96347599d13429c"
  ],
  "units": "mm",
  "process_family": "cad_handoff",
  "material": null,
  "machine_profile": null,
  "controller_profile": null,
  "setup": null,
  "workholding": null,
  "work_coordinate_system": null,
  "tool_library": null,
  "cam_system": null,
  "postprocessor": null,
  "post_version": null,
  "generated_manufacturing_output": null,
  "simulation_status": "unknown",
  "verification_results": [
    {
      "check_id": "cad_negative_case",
      "status": "failed",
      "summary": "The SVG visible BASE annotation states 61 x 40 x 6, while its description, rectangle and source retain width 60. All revision labels remain A, so agreement of revision labels does not resolve dimensional intent.",
      "evidence": [
        "docs/evaluation/cad-runs/2026-09-17-conflicting-dimensions/observed.json",
        "docs/evaluation/cad-runs/2026-09-17-conflicting-dimensions/review.md"
      ]
    }
  ],
  "jurisdiction": null,
  "ip_status": {
    "ownership_status": "owned",
    "licence_status": "permitted",
    "confidentiality": "public",
    "redistribution_authorized": true,
    "third_party_restrictions": [],
    "evidence_scope": "Public synthetic fixture evaluation only; no external manufacturing authorization inferred."
  },
  "export_review_status": "not_required",
  "approval_status": "not_requested"
}
